[
  {
    "schemaVersion": 3,
    "id": 1,
    "title": "Первые розы",
    "difficulty": "easy",
    "moves": 18,
    "starThresholds": {
      "twoStarsMovesLeft": 4,
      "threeStarsMovesLeft": 10
    },
    "board": {
      "mask": [
        "11111111",
        "11111111",
        "11111111",
        "11111111",
        "11111111",
        "11111111",
        "11111111",
        "11111111"
      ],
      "obstacles": []
    },
    "objectives": [
      {
        "id": "primary",
        "type": "collect",
        "tileType": 0,
        "target": 15
      }
    ]
  },
  {
    "schemaVersion": 3,
    "id": 2,
    "title": "Тлеющие свечи",
    "difficulty": "normal",
    "moves": 18,
    "starThresholds": {
      "twoStarsMovesLeft": 4,
      "threeStarsMovesLeft": 9
    },
    "board": {
      "mask": [
        "11111111",
        "11111111",
        "11111111",
        "11111111",
        "11111111",
        "11111111",
        "11111111",
        "11111111"
      ],
      "obstacles": []
    },
    "objectives": [
      {
        "id": "primary",
        "type": "collect",
        "tileType": 1,
        "target": 18
      }
    ]
  },
  {
    "schemaVersion": 3,
    "id": 3,
    "title": "Связка ключей",
    "difficulty": "hard",
    "moves": 18,
    "starThresholds": {
      "twoStarsMovesLeft": 3,
      "threeStarsMovesLeft": 7
    },
    "board": {
      "mask": [
        "11111111",
        "11111111",
        "11111111",
        "11111111",
        "11111111",
        "11111111",
        "11111111",
        "11111111"
      ],
      "obstacles": []
    },
    "objectives": [
      {
        "id": "primary",
        "type": "collect",
        "tileType": 2,
        "target": 21
      }
    ]
  },
  {
    "schemaVersion": 3,
    "id": 4,
    "title": "Срезанные углы",
    "difficulty": "easy",
    "moves": 20,
    "starThresholds": {
      "twoStarsMovesLeft": 4,
      "threeStarsMovesLeft": 9
    },
    "board": {
      "mask": [
        "01111110",
        "11111111",
        "11111111",
        "11111111",
        "11111111",
        "11111111",
        "11111111",
        "01111110"
      ],
      "obstacles": []
    },
    "objectives": [
      {
        "id": "crystals",
        "type": "collect",
        "tileType": 3,
        "target": 14
      },
      {
        "id": "roses",
        "type": "collect",
        "tileType": 0,
        "target": 12
      }
    ]
  },
  {
    "schemaVersion": 3,
    "id": 5,
    "title": "Скованные вороны",
    "difficulty": "normal",
    "moves": 21,
    "starThresholds": {
      "twoStarsMovesLeft": 4,
      "threeStarsMovesLeft": 8
    },
    "board": {
      "mask": [
        "11111111",
        "11111111",
        "11111111",
        "11111111",
        "11111111",
        "11111111",
        "11111111",
        "11111111"
      ],
      "obstacles": [
        {
          "row": 2,
          "col": 2,
          "kind": "chain",
          "layers": 1
        },
        {
          "row": 2,
          "col": 5,
          "kind": "chain",
          "layers": 1
        },
        {
          "row": 3,
          "col": 3,
          "kind": "chain",
          "layers": 1
        },
        {
          "row": 3,
          "col": 4,
          "kind": "chain",
          "layers": 1
        },
        {
          "row": 5,
          "col": 2,
          "kind": "chain",
          "layers": 1
        },
        {
          "row": 5,
          "col": 5,
          "kind": "chain",
          "layers": 1
        }
      ]
    },
    "objectives": [
      {
        "id": "chains",
        "type": "clear-obstacle",
        "obstacleKind": "chain",
        "target": 6
      },
      {
        "id": "ravens",
        "type": "collect",
        "tileType": 4,
        "target": 16
      }
    ]
  },
  {
    "schemaVersion": 3,
    "id": 6,
    "title": "Заваленный архив",
    "difficulty": "hard",
    "moves": 23,
    "starThresholds": {
      "twoStarsMovesLeft": 3,
      "threeStarsMovesLeft": 7
    },
    "board": {
      "mask": [
        "11111111",
        "11111111",
        "11111111",
        "11111111",
        "11111111",
        "11111111",
        "11111111",
        "11111111"
      ],
      "obstacles": [
        {
          "row": 2,
          "col": 1,
          "kind": "rubble",
          "layers": 1
        },
        {
          "row": 2,
          "col": 3,
          "kind": "rubble",
          "layers": 1
        },
        {
          "row": 2,
          "col": 4,
          "kind": "rubble",
          "layers": 1
        },
        {
          "row": 2,
          "col": 6,
          "kind": "rubble",
          "layers": 1
        },
        {
          "row": 5,
          "col": 1,
          "kind": "rubble",
          "layers": 1
        },
        {
          "row": 5,
          "col": 3,
          "kind": "rubble",
          "layers": 1
        },
        {
          "row": 5,
          "col": 4,
          "kind": "rubble",
          "layers": 1
        },
        {
          "row": 5,
          "col": 6,
          "kind": "rubble",
          "layers": 1
        }
      ]
    },
    "objectives": [
      {
        "id": "rubble",
        "type": "clear-obstacle",
        "obstacleKind": "rubble",
        "target": 8
      },
      {
        "id": "scrolls",
        "type": "collect",
        "tileType": 5,
        "target": 18
      }
    ]
  },
  {
    "schemaVersion": 3,
    "id": 7,
    "title": "Туман в розарии",
    "difficulty": "normal",
    "moves": 23,
    "starThresholds": {
      "twoStarsMovesLeft": 4,
      "threeStarsMovesLeft": 9
    },
    "board": {
      "mask": [
        "01111110",
        "11111111",
        "11111111",
        "11111111",
        "11111111",
        "11111111",
        "11111111",
        "01111110"
      ],
      "obstacles": [
        {
          "row": 2,
          "col": 2,
          "kind": "fog",
          "layers": 1
        },
        {
          "row": 2,
          "col": 3,
          "kind": "fog",
          "layers": 1
        },
        {
          "row": 2,
          "col": 4,
          "kind": "fog",
          "layers": 1
        },
        {
          "row": 2,
          "col": 5,
          "kind": "fog",
          "layers": 1
        },
        {
          "row": 5,
          "col": 2,
          "kind": "fog",
          "layers": 1
        },
        {
          "row": 5,
          "col": 3,
          "kind": "fog",
          "layers": 1
        },
        {
          "row": 5,
          "col": 4,
          "kind": "fog",
          "layers": 1
        },
        {
          "row": 5,
          "col": 5,
          "kind": "fog",
          "layers": 1
        }
      ]
    },
    "objectives": [
      {
        "id": "fog",
        "type": "clear-obstacle",
        "obstacleKind": "fog",
        "target": 8
      },
      {
        "id": "roses",
        "type": "collect",
        "tileType": 0,
        "target": 20
      }
    ]
  },
  {
    "schemaVersion": 3,
    "id": 8,
    "title": "Песочные часы",
    "difficulty": "hard",
    "moves": 24,
    "starThresholds": {
      "twoStarsMovesLeft": 3,
      "threeStarsMovesLeft": 7
    },
    "board": {
      "mask": [
        "11111111",
        "01111110",
        "00111100",
        "00111100",
        "00111100",
        "00111100",
        "01111110",
        "11111111"
      ],
      "obstacles": [
        {
          "row": 2,
          "col": 2,
          "kind": "chain",
          "layers": 2
        },
        {
          "row": 2,
          "col": 5,
          "kind": "chain",
          "layers": 2
        },
        {
          "row": 5,
          "col": 2,
          "kind": "chain",
          "layers": 2
        },
        {
          "row": 5,
          "col": 5,
          "kind": "chain",
          "layers": 2
        }
      ]
    },
    "objectives": [
      {
        "id": "chains",
        "type": "clear-obstacle",
        "obstacleKind": "chain",
        "target": 4
      },
      {
        "id": "candles",
        "type": "collect",
        "tileType": 1,
        "target": 18
      },
      {
        "id": "keys",
        "type": "collect",
        "tileType": 2,
        "target": 14
      }
    ]
  },
  {
    "schemaVersion": 3,
    "id": 9,
    "title": "Коридоры крипты",
    "difficulty": "hard",
    "moves": 25,
    "starThresholds": {
      "twoStarsMovesLeft": 3,
      "threeStarsMovesLeft": 7
    },
    "board": {
      "mask": [
        "11111111",
        "11111111",
        "11100111",
        "11111111",
        "11111111",
        "11100111",
        "11111111",
        "11111111"
      ],
      "obstacles": [
        {
          "row": 3,
          "col": 2,
          "kind": "rubble",
          "layers": 2
        },
        {
          "row": 3,
          "col": 5,
          "kind": "rubble",
          "layers": 2
        },
        {
          "row": 4,
          "col": 2,
          "kind": "rubble",
          "layers": 1
        },
        {
          "row": 4,
          "col": 5,
          "kind": "rubble",
          "layers": 1
        },
        {
          "row": 1,
          "col": 3,
          "kind": "fog",
          "layers": 1
        },
        {
          "row": 1,
          "col": 4,
          "kind": "fog",
          "layers": 1
        },
        {
          "row": 6,
          "col": 3,
          "kind": "fog",
          "layers": 1
        },
        {
          "row": 6,
          "col": 4,
          "kind": "fog",
          "layers": 1
        }
      ]
    },
    "objectives": [
      {
        "id": "rubble",
        "type": "clear-obstacle",
        "obstacleKind": "rubble",
        "target": 4
      },
      {
        "id": "fog",
        "type": "clear-obstacle",
        "obstacleKind": "fog",
        "target": 4
      },
      {
        "id": "keys",
        "type": "collect",
        "tileType": 2,
        "target": 18
      }
    ]
  },
  {
    "schemaVersion": 3,
    "id": 10,